{"schema_version":"1.0.0","algorithm":"needleman-wunsch","engine":{"language":"python","name":"biodp","version":"0.1.0"},"inputs":{"seq_a":"GATTACA","seq_b":"GCATGCU","scoring":{"substitution":{"name":"match+1/mismatch-1","alphabet":"ACGTU","scores":[[1,-1,-1,-1,-1],[-1,1,-1,-1,-1],[-1,-1,1,-1,-1],[-1,-1,-1,1,-1],[-1,-1,-1,-1,1]]},"gap":{"open":-1,"extend":-1}}},"shape":[8,8],"fill_order":{"kind":"row-major"},"projection":{"scores":[[0,-1,-2,-3,-4,-5,-6,-7],[-1,1,0,-1,-2,-3,-4,-5],[-2,0,0,1,0,-1,-2,-3],[-3,-1,-1,0,2,1,0,-1],[-4,-2,-2,-1,1,1,0,-1],[-5,-3,-3,-1,0,0,0,-1],[-6,-4,-2,-2,-1,-1,1,0],[-7,-5,-3,-1,-2,-2,0,0]],"moves":[[0,4,4,4,4,4,4,4],[2,1,4,4,4,5,4,4],[2,2,1,1,4,4,4,4],[2,2,3,2,1,4,4,4],[2,2,3,2,3,1,5,5],[2,2,3,1,2,3,1,5],[2,2,1,2,2,3,1,4],[2,2,2,1,6,3,2,1]],"on_optimal_path":[[true,false,false,false,false,false,false,false],[false,true,true,false,false,false,false,false],[false,false,false,true,false,false,false,false],[false,false,false,true,true,false,false,false],[false,false,false,false,true,true,false,false],[false,false,false,false,false,true,false,false],[false,false,false,false,false,false,true,false],[false,false,false,false,false,false,false,true]]},"result":{"score":0,"optimal_count":"3","alignments":[{"aligned_a":"G-ATTACA","aligned_b":"GCA-TGCU","cigar":"1=1I1=1D1=1X1=1X","path":[[0,0],[1,1],[1,2],[2,3],[3,3],[4,4],[5,5],[6,6],[7,7]]},{"aligned_a":"G-ATTACA","aligned_b":"GCAT-GCU","cigar":"1=1I2=1D1X1=1X","path":[[0,0],[1,1],[1,2],[2,3],[3,4],[4,4],[5,5],[6,6],[7,7]]},{"aligned_a":"G-ATTACA","aligned_b":"GCATG-CU","cigar":"1=1I2=1X1D1=1X","path":[[0,0],[1,1],[1,2],[2,3],[3,4],[4,5],[5,5],[6,6],[7,7]]}],"alignments_truncated":false},"layers":[{"name":"M","scores":[[0,null,null,null,null,null,null,null],[null,1,-2,-3,-4,-3,-6,-7],[null,-2,0,1,-2,-3,-4,-5],[null,-3,-1,-1,2,-1,-2,-3],[null,-4,-2,-2,1,1,0,-1],[null,-5,-3,-1,-2,0,0,-1],[null,-6,-2,-4,-2,-1,1,-1],[null,-7,-5,-1,-3,-2,-2,0]],"predecessors":[[0,0,0,0,0,0,0,0],[0,1,4,4,4,4,4,4],[0,2,1,4,4,4,5,4],[0,2,2,1,1,4,4,4],[0,2,2,3,2,1,4,4],[0,2,2,3,2,3,1,5],[0,2,2,3,1,2,3,1],[0,2,2,1,2,2,3,1]]},{"name":"X","scores":[[null,null,null,null,null,null,null,null],[-1,-2,-3,-4,-5,-6,-7,-8],[-2,0,-1,-2,-3,-4,-5,-6],[-3,-1,-1,0,-1,-2,-3,-4],[-4,-2,-2,-1,1,0,-1,-2],[-5,-3,-3,-2,0,0,-1,-2],[-6,-4,-4,-2,-1,-1,-1,-2],[-7,-5,-3,-3,-2,-2,0,-1]],"predecessors":[[0,0,0,0,0,0,0,0],[1,4,4,4,4,4,4,4],[2,1,4,4,4,5,4,4],[2,2,1,1,4,4,4,4],[2,2,3,2,1,4,4,4],[2,2,3,2,3,1,5,5],[2,2,3,1,2,3,1,5],[2,2,1,2,2,3,1,4]]},{"name":"Y","scores":[[null,-1,-2,-3,-4,-5,-6,-7],[null,-2,0,-1,-2,-3,-4,-5],[null,-3,-1,-1,0,-1,-2,-3],[null,-4,-2,-2,-1,1,0,-1],[null,-5,-3,-3,-2,0,0,-1],[null,-6,-4,-4,-2,-1,-1,-1],[null,-7,-5,-3,-3,-2,-2,0],[null,-8,-6,-4,-2,-3,-3,-1]],"predecessors":[[0,1,4,4,4,4,4,4],[0,2,1,4,4,4,5,4],[0,2,2,1,1,4,4,4],[0,2,2,3,2,1,4,4],[0,2,2,3,2,3,1,5],[0,2,2,3,1,2,3,1],[0,2,2,1,2,2,3,1],[0,2,2,2,1,6,3,2]]}]}
