{"schema_version":"1.1.0","algorithm":"needleman-wunsch","engine":{"language":"python","name":"biodp","version":"0.1.0"},"inputs":{"seq_a":"A","seq_b":"C","scoring":{"substitution":{"name":"match+1/mismatch-10","alphabet":"ACGT","scores":[[1,-10,-10,-10],[-10,1,-10,-10],[-10,-10,1,-10],[-10,-10,-10,1]]},"gap":{"open":-1,"extend":-1}}},"shape":[2,2],"fill_order":{"kind":"row-major"},"projection":{"scores":[[0,-1],[-1,-2]],"moves":[[0,4],[2,6]],"on_optimal_path":[[true,true],[true,true]]},"result":{"score":-2,"optimal_count":"2","alignments":[{"aligned_a":"-A","aligned_b":"C-","cigar":"1I1D","path":[[0,0],[0,1],[1,1]]},{"aligned_a":"A-","aligned_b":"-C","cigar":"1D1I","path":[[0,0],[1,0],[1,1]]}],"alignments_truncated":false},"layers":[{"name":"M","scores":[[0,null],[null,-10]],"predecessors":[[0,0],[0,1]]},{"name":"X","scores":[[null,null],[-1,-2]],"predecessors":[[0,0],[1,4]]},{"name":"Y","scores":[[null,-1],[null,-2]],"predecessors":[[0,1],[0,2]]}]}
