{"schema_version":"1.1.0","algorithm":"needleman-wunsch","engine":{"language":"python","name":"biodp","version":"0.1.0"},"inputs":{"seq_a":"HEAGAWGHEE","seq_b":"PAWHEAE","scoring":{"substitution":{"name":"BLOSUM62","alphabet":"ARNDCQEGHILKMFPSTWYVBZX*","scores":[[4,-1,-2,-2,0,-1,-1,0,-2,-1,-1,-1,-1,-2,-1,1,0,-3,-2,0,-2,-1,0,-4],[-1,5,0,-2,-3,1,0,-2,0,-3,-2,2,-1,-3,-2,-1,-1,-3,-2,-3,-1,0,-1,-4],[-2,0,6,1,-3,0,0,0,1,-3,-3,0,-2,-3,-2,1,0,-4,-2,-3,3,0,-1,-4],[-2,-2,1,6,-3,0,2,-1,-1,-3,-4,-1,-3,-3,-1,0,-1,-4,-3,-3,4,1,-1,-4],[0,-3,-3,-3,9,-3,-4,-3,-3,-1,-1,-3,-1,-2,-3,-1,-1,-2,-2,-1,-3,-3,-2,-4],[-1,1,0,0,-3,5,2,-2,0,-3,-2,1,0,-3,-1,0,-1,-2,-1,-2,0,3,-1,-4],[-1,0,0,2,-4,2,5,-2,0,-3,-3,1,-2,-3,-1,0,-1,-3,-2,-2,1,4,-1,-4],[0,-2,0,-1,-3,-2,-2,6,-2,-4,-4,-2,-3,-3,-2,0,-2,-2,-3,-3,-1,-2,-1,-4],[-2,0,1,-1,-3,0,0,-2,8,-3,-3,-1,-2,-1,-2,-1,-2,-2,2,-3,0,0,-1,-4],[-1,-3,-3,-3,-1,-3,-3,-4,-3,4,2,-3,1,0,-3,-2,-1,-3,-1,3,-3,-3,-1,-4],[-1,-2,-3,-4,-1,-2,-3,-4,-3,2,4,-2,2,0,-3,-2,-1,-2,-1,1,-4,-3,-1,-4],[-1,2,0,-1,-3,1,1,-2,-1,-3,-2,5,-1,-3,-1,0,-1,-3,-2,-2,0,1,-1,-4],[-1,-1,-2,-3,-1,0,-2,-3,-2,1,2,-1,5,0,-2,-1,-1,-1,-1,1,-3,-1,-1,-4],[-2,-3,-3,-3,-2,-3,-3,-3,-1,0,0,-3,0,6,-4,-2,-2,1,3,-1,-3,-3,-1,-4],[-1,-2,-2,-1,-3,-1,-1,-2,-2,-3,-3,-1,-2,-4,7,-1,-1,-4,-3,-2,-2,-1,-2,-4],[1,-1,1,0,-1,0,0,0,-1,-2,-2,0,-1,-2,-1,4,1,-3,-2,-2,0,0,0,-4],[0,-1,0,-1,-1,-1,-1,-2,-2,-1,-1,-1,-1,-2,-1,1,5,-2,-2,0,-1,-1,0,-4],[-3,-3,-4,-4,-2,-2,-3,-2,-2,-3,-2,-3,-1,1,-4,-3,-2,11,2,-3,-4,-3,-2,-4],[-2,-2,-2,-3,-2,-1,-2,-3,2,-1,-1,-2,-1,3,-3,-2,-2,2,7,-1,-3,-2,-1,-4],[0,-3,-3,-3,-1,-2,-2,-3,-3,3,1,-2,1,-1,-2,-2,0,-3,-1,4,-3,-2,-1,-4],[-2,-1,3,4,-3,0,1,-1,0,-3,-4,0,-3,-3,-2,0,-1,-4,-3,-3,4,1,-1,-4],[-1,0,0,1,-3,3,4,-2,0,-3,-3,1,-1,-3,-1,0,-1,-3,-2,-2,1,4,-1,-4],[0,-1,-1,-1,-2,-1,-1,-1,-1,-1,-1,-1,-1,-1,-2,0,0,-2,-1,-1,-1,-1,-1,-4],[-4,-4,-4,-4,-4,-4,-4,-4,-4,-4,-4,-4,-4,-4,-4,-4,-4,-4,-4,-4,-4,-4,-4,1]]},"gap":{"open":-11,"extend":-1}}},"shape":[11,8],"fill_order":{"kind":"row-major"},"projection":{"scores":[[0,-11,-12,-13,-14,-15,-16,-17],[-11,-2,-13,-14,-5,-14,-17,-16],[-12,-12,-3,-14,-14,0,-11,-12],[-13,-13,-8,-6,-16,-11,4,-7],[-14,-15,-13,-10,-8,-12,-7,2],[-15,-15,-11,-16,-12,-9,-8,-8],[-16,-17,-17,0,-11,-12,-9,-10],[-17,-18,-17,-11,-2,-13,-10,-11],[-18,-19,-19,-12,-3,-2,-11,-10],[-19,-19,-20,-13,-12,2,-3,-6],[-20,-20,-20,-14,-13,-7,1,2]],"moves":[[0,4,4,4,4,4,4,4],[2,1,5,5,1,1,5,1],[2,1,1,4,1,1,4,5],[2,1,1,1,1,2,1,4],[2,3,1,1,1,2,2,1],[2,1,1,1,1,1,3,1],[2,2,2,1,4,4,2,2],[2,3,1,2,1,5,2,3],[2,3,2,2,1,1,2,1],[2,1,3,2,1,1,1,1],[2,1,1,2,1,1,1,1]],"on_optimal_path":[[true,false,false,false,false,false,false,false],[true,true,false,false,false,false,false,false],[true,true,false,false,false,false,false,false],[true,true,false,false,false,false,false,false],[false,true,false,false,false,false,false,false],[false,false,true,false,false,false,false,false],[false,false,false,true,false,false,false,false],[false,false,false,false,true,false,false,false],[false,false,false,false,false,true,false,false],[false,false,false,false,false,false,true,false],[false,false,false,false,false,false,false,true]]},"result":{"score":2,"optimal_count":"2","alignments":[{"aligned_a":"HEAGAWGHEE","aligned_b":"---PAWHEAE","cigar":"3D1X2=3X1=","path":[[0,0],[1,0],[2,0],[3,0],[4,1],[5,2],[6,3],[7,4],[8,5],[9,6],[10,7]]},{"aligned_a":"HEAGAWGHEE","aligned_b":"P---AWHEAE","cigar":"1X3D2=3X1=","path":[[0,0],[1,1],[2,1],[3,1],[4,1],[5,2],[6,3],[7,4],[8,5],[9,6],[10,7]]}],"alignments_truncated":false},"layers":[{"name":"M","scores":[[0,null,null,null,null,null,null,null],[null,-2,-13,-14,-5,-14,-17,-16],[null,-12,-3,-16,-14,0,-15,-12],[null,-13,-8,-6,-16,-15,4,-12],[null,-15,-13,-10,-8,-18,-11,2],[null,-15,-11,-16,-12,-9,-8,-8],[null,-19,-18,0,-18,-15,-12,-11],[null,-18,-17,-19,-2,-13,-12,-11],[null,-19,-20,-19,-3,-2,-15,-10],[null,-19,-20,-22,-12,2,-3,-6],[null,-20,-20,-23,-13,-7,1,2]],"predecessors":[[0,0,0,0,0,0,0,0],[0,1,4,4,4,4,4,4],[0,2,1,5,5,1,1,5],[0,2,1,1,4,1,1,4],[0,2,1,1,1,1,2,1],[0,2,3,1,1,1,2,2],[0,2,1,1,1,1,1,3],[0,2,2,2,1,4,4,2],[0,2,3,1,2,1,5,2],[0,2,3,2,2,1,1,2],[0,2,1,3,2,1,1,1]]},{"name":"X","scores":[[null,null,null,null,null,null,null,null],[-11,-22,-23,-24,-25,-26,-27,-28],[-12,-13,-24,-25,-16,-25,-28,-27],[-13,-14,-14,-25,-17,-11,-22,-23],[-14,-15,-15,-17,-18,-12,-7,-18],[-15,-16,-16,-18,-19,-13,-8,-9],[-16,-17,-17,-19,-20,-14,-9,-10],[-17,-18,-18,-11,-21,-15,-10,-11],[-18,-19,-19,-12,-13,-16,-11,-12],[-19,-20,-20,-13,-14,-13,-12,-13],[-20,-21,-21,-14,-15,-9,-13,-14]],"predecessors":[[0,0,0,0,0,0,0,0],[1,4,4,4,4,4,4,4],[2,1,7,7,1,1,7,1],[2,2,1,4,2,1,4,5],[2,2,2,1,2,2,1,4],[2,2,2,2,3,2,2,1],[2,2,2,2,2,2,2,2],[2,2,2,1,2,2,2,2],[2,2,2,2,1,2,2,2],[2,2,2,2,3,1,2,2],[2,2,2,2,2,1,2,2]]},{"name":"Y","scores":[[null,-11,-12,-13,-14,-15,-16,-17],[null,-22,-13,-14,-15,-16,-17,-18],[null,-23,-23,-14,-15,-16,-11,-12],[null,-24,-24,-19,-17,-18,-19,-7],[null,-25,-26,-24,-21,-19,-20,-18],[null,-26,-26,-22,-23,-23,-20,-19],[null,-27,-28,-28,-11,-12,-13,-14],[null,-28,-29,-28,-22,-13,-14,-15],[null,-29,-30,-30,-23,-14,-13,-14],[null,-30,-30,-31,-24,-23,-9,-10],[null,-31,-31,-31,-25,-24,-18,-10]],"predecessors":[[0,1,4,4,4,4,4,4],[0,2,1,4,4,5,4,4],[0,2,1,1,4,4,1,4],[0,2,1,1,1,4,4,1],[0,2,7,1,1,1,4,2],[0,2,1,1,4,1,1,3],[0,2,6,2,1,4,4,4],[0,2,7,1,2,1,4,4],[0,2,7,2,2,1,1,4],[0,2,1,7,2,1,1,4],[0,2,1,1,2,1,1,1]]}]}
