{"schema_version":"1.1.0","algorithm":"needleman-wunsch","engine":{"language":"python","name":"biodp","version":"0.1.0"},"inputs":{"seq_a":"AAA","seq_b":"AA","scoring":{"substitution":{"name":"match+1/mismatch-1","alphabet":"ACGT","scores":[[1,-1,-1,-1],[-1,1,-1,-1],[-1,-1,1,-1],[-1,-1,-1,1]]},"gap":{"open":-1,"extend":-1}}},"shape":[4,3],"fill_order":{"kind":"row-major"},"projection":{"scores":[[0,-1,-2],[-1,1,0],[-2,0,2],[-3,-1,1]],"moves":[[0,4,4],[2,1,5],[2,3,1],[2,3,3]],"on_optimal_path":[[true,false,false],[true,true,false],[false,true,true],[false,false,true]]},"result":{"score":1,"optimal_count":"3","alignments":[{"aligned_a":"AAA","aligned_b":"-AA","cigar":"1D2=","path":[[0,0],[1,0],[2,1],[3,2]]},{"aligned_a":"AAA","aligned_b":"A-A","cigar":"1=1D1=","path":[[0,0],[1,1],[2,1],[3,2]]},{"aligned_a":"AAA","aligned_b":"AA-","cigar":"2=1D","path":[[0,0],[1,1],[2,2],[3,2]]}],"alignments_truncated":false},"layers":[{"name":"M","scores":[[0,null,null],[null,1,0],[null,0,2],[null,-1,1]],"predecessors":[[0,0,0],[0,1,4],[0,2,1],[0,2,3]]},{"name":"X","scores":[[null,null,null],[-1,-2,-3],[-2,0,-1],[-3,-1,1]],"predecessors":[[0,0,0],[1,4,4],[2,1,5],[2,3,1]]},{"name":"Y","scores":[[null,-1,-2],[null,-2,0],[null,-3,-1],[null,-4,-2]],"predecessors":[[0,1,4],[0,2,1],[0,2,3],[0,2,3]]}]}
