{"schema_version":"1.0.0","algorithm":"needleman-wunsch","engine":{"language":"python","name":"biodp","version":"0.1.0"},"inputs":{"seq_a":"","seq_b":"","scoring":{"substitution":{"name":"match+1/mismatch-1","alphabet":"ACGT","scores":[[1,-1,-1,-1],[-1,1,-1,-1],[-1,-1,1,-1],[-1,-1,-1,1]]},"gap":{"open":-1,"extend":-1}}},"shape":[1,1],"fill_order":{"kind":"row-major"},"projection":{"scores":[[0]],"moves":[[0]],"on_optimal_path":[[true]]},"result":{"score":0,"optimal_count":"1","alignments":[{"aligned_a":"","aligned_b":"","cigar":"","path":[[0,0]]}],"alignments_truncated":false},"layers":[{"name":"M","scores":[[0]],"predecessors":[[0]]},{"name":"X","scores":[[null]],"predecessors":[[0]]},{"name":"Y","scores":[[null]],"predecessors":[[0]]}]}
