{"schema_version":"1.0.0","algorithm":"needleman-wunsch","engine":{"language":"python","name":"biodp","version":"0.1.0"},"inputs":{"seq_a":"","seq_b":"ACG","scoring":{"substitution":{"name":"match+1/mismatch-1","alphabet":"ACGT","scores":[[1,-1,-1,-1],[-1,1,-1,-1],[-1,-1,1,-1],[-1,-1,-1,1]]},"gap":{"open":-2,"extend":-1}}},"shape":[1,4],"fill_order":{"kind":"row-major"},"projection":{"scores":[[0,-2,-3,-4]],"moves":[[0,4,4,4]],"on_optimal_path":[[true,true,true,true]]},"result":{"score":-4,"optimal_count":"1","alignments":[{"aligned_a":"---","aligned_b":"ACG","cigar":"3I","path":[[0,0],[0,1],[0,2],[0,3]]}],"alignments_truncated":false},"layers":[{"name":"M","scores":[[0,null,null,null]],"predecessors":[[0,0,0,0]]},{"name":"X","scores":[[null,null,null,null]],"predecessors":[[0,0,0,0]]},{"name":"Y","scores":[[null,-2,-3,-4]],"predecessors":[[0,1,4,4]]}]}
