{"schema_version":"1.0.0","algorithm":"needleman-wunsch","engine":{"language":"python","name":"biodp","version":"0.1.0"},"inputs":{"seq_a":"ACGTTTTACG","seq_b":"ACGACG","scoring":{"substitution":{"name":"match+2/mismatch-3","alphabet":"ACGT","scores":[[2,-3,-3,-3],[-3,2,-3,-3],[-3,-3,2,-3],[-3,-3,-3,2]]},"gap":{"open":-5,"extend":-1}}},"shape":[11,7],"fill_order":{"kind":"row-major"},"projection":{"scores":[[0,-5,-6,-7,-8,-9,-10],[-5,2,-3,-4,-5,-6,-7],[-6,-3,4,-1,-2,-3,-4],[-7,-4,-1,6,1,0,-1],[-8,-5,-2,1,3,-2,-3],[-9,-6,-3,0,-2,0,-5],[-10,-7,-4,-1,-3,-5,-3],[-11,-8,-5,-2,-4,-6,-8],[-12,-9,-6,-3,0,-5,-6],[-13,-10,-7,-4,-5,2,-3],[-14,-11,-8,-5,-6,-3,4]],"moves":[[0,4,4,4,4,4,4],[2,1,4,4,5,4,4],[2,2,1,4,4,5,4],[2,2,2,1,4,4,5],[2,2,2,2,1,5,5],[2,2,2,2,3,1,5],[2,2,2,2,3,3,1],[2,2,2,2,3,3,3],[2,3,2,2,1,4,4],[2,2,3,2,2,1,4],[2,2,2,3,2,2,1]],"on_optimal_path":[[true,false,false,false,false,false,false],[false,true,false,false,false,false,false],[false,false,true,false,false,false,false],[false,false,false,true,false,false,false],[false,false,false,true,false,false,false],[false,false,false,true,false,false,false],[false,false,false,true,false,false,false],[false,false,false,true,false,false,false],[false,false,false,false,true,false,false],[false,false,false,false,false,true,false],[false,false,false,false,false,false,true]]},"result":{"score":4,"optimal_count":"1","alignments":[{"aligned_a":"ACGTTTTACG","aligned_b":"ACG----ACG","cigar":"3=4D3=","path":[[0,0],[1,1],[2,2],[3,3],[4,3],[5,3],[6,3],[7,3],[8,4],[9,5],[10,6]]}],"alignments_truncated":false},"layers":[{"name":"M","scores":[[0,null,null,null,null,null,null],[null,2,-8,-9,-5,-11,-12],[null,-8,4,-6,-7,-3,-9],[null,-9,-6,6,-4,-5,-1],[null,-10,-7,-4,3,-2,-3],[null,-11,-8,-5,-2,0,-5],[null,-12,-9,-6,-3,-5,-3],[null,-13,-10,-7,-4,-6,-8],[null,-9,-11,-8,0,-7,-9],[null,-15,-7,-9,-6,2,-8],[null,-16,-13,-5,-7,-8,4]],"predecessors":[[0,0,0,0,0,0,0],[0,1,4,4,4,4,4],[0,2,1,4,4,5,4],[0,2,2,1,4,4,5],[0,2,2,2,1,4,4],[0,2,2,2,2,1,5],[0,2,2,2,2,3,1],[0,2,2,2,2,3,3],[0,2,2,2,2,3,3],[0,2,3,2,2,1,4],[0,2,2,3,2,2,1]]},{"name":"X","scores":[[null,null,null,null,null,null,null],[-5,-10,-11,-12,-13,-14,-15],[-6,-3,-8,-9,-10,-11,-12],[-7,-4,-1,-6,-7,-8,-9],[-8,-5,-2,1,-4,-5,-6],[-9,-6,-3,0,-2,-6,-7],[-10,-7,-4,-1,-3,-5,-8],[-11,-8,-5,-2,-4,-6,-8],[-12,-9,-6,-3,-5,-7,-9],[-13,-10,-7,-4,-5,-8,-10],[-14,-11,-8,-5,-6,-3,-8]],"predecessors":[[0,0,0,0,0,0,0],[1,4,4,4,4,4,4],[2,1,4,4,5,4,4],[2,2,1,4,4,5,4],[2,2,2,1,4,4,5],[2,2,2,2,1,2,2],[2,2,2,2,2,1,2],[2,2,2,2,2,2,1],[2,2,2,2,2,2,2],[2,2,2,2,1,2,2],[2,2,2,2,2,1,4]]},{"name":"Y","scores":[[null,-5,-6,-7,-8,-9,-10],[null,-10,-3,-4,-5,-6,-7],[null,-11,-8,-1,-2,-3,-4],[null,-12,-9,-6,1,0,-1],[null,-13,-10,-7,-4,-2,-3],[null,-14,-11,-8,-5,-6,-5],[null,-15,-12,-9,-6,-7,-8],[null,-16,-13,-10,-7,-8,-9],[null,-17,-14,-11,-8,-5,-6],[null,-18,-15,-12,-9,-10,-3],[null,-19,-16,-13,-10,-11,-8]],"predecessors":[[0,1,4,4,4,4,4],[0,2,1,4,4,4,4],[0,2,2,1,4,4,4],[0,2,2,2,1,4,4],[0,2,2,2,2,1,4],[0,2,2,2,2,4,1],[0,2,2,2,2,4,4],[0,2,2,2,2,4,4],[0,2,3,2,2,1,4],[0,2,2,3,2,6,1],[0,2,2,2,3,6,2]]}]}
