{"schema_version":"1.1.0","algorithm":"needleman-wunsch","engine":{"language":"python","name":"biodp","version":"0.1.0"},"inputs":{"seq_a":"GCAAAAAAAATC","seq_b":"GCAAAAATC","scoring":{"substitution":{"name":"match+1/mismatch-1","alphabet":"ACGT","scores":[[1,-1,-1,-1],[-1,1,-1,-1],[-1,-1,1,-1],[-1,-1,-1,1]]},"gap":{"open":-2,"extend":-2}}},"shape":[13,10],"fill_order":{"kind":"row-major"},"projection":{"scores":[[0,-2,-4,-6,-8,-10,-12,-14,-16,-18],[-2,1,-1,-3,-5,-7,-9,-11,-13,-15],[-4,-1,2,0,-2,-4,-6,-8,-10,-12],[-6,-3,0,3,1,-1,-3,-5,-7,-9],[-8,-5,-2,1,4,2,0,-2,-4,-6],[-10,-7,-4,-1,2,5,3,1,-1,-3],[-12,-9,-6,-3,0,3,6,4,2,0],[-14,-11,-8,-5,-2,1,4,7,5,3],[-16,-13,-10,-7,-4,-1,2,5,6,4],[-18,-15,-12,-9,-6,-3,0,3,4,5],[-20,-17,-14,-11,-8,-5,-2,1,2,3],[-22,-19,-16,-13,-10,-7,-4,-1,2,1],[-24,-21,-18,-15,-12,-9,-6,-3,0,3]],"moves":[[0,4,4,4,4,4,4,4,4,4],[2,1,4,4,4,4,4,4,4,4],[2,2,1,4,4,4,4,4,4,5],[2,2,2,1,5,5,5,5,4,4],[2,2,2,3,1,5,5,5,4,4],[2,2,2,3,3,1,5,5,4,4],[2,2,2,3,3,3,1,5,4,4],[2,2,2,3,3,3,3,1,4,4],[2,2,2,3,3,3,3,3,1,5],[2,2,2,3,3,3,3,3,3,1],[2,2,2,3,3,3,3,3,3,3],[2,2,2,2,2,2,2,2,1,3],[2,2,3,2,2,2,2,2,2,1]],"on_optimal_path":[[true,false,false,false,false,false,false,false,false,false],[false,true,false,false,false,false,false,false,false,false],[false,false,true,false,false,false,false,false,false,false],[false,false,true,true,false,false,false,false,false,false],[false,false,true,true,true,false,false,false,false,false],[false,false,true,true,true,true,false,false,false,false],[false,false,false,true,true,true,true,false,false,false],[false,false,false,false,true,true,true,true,false,false],[false,false,false,false,false,true,true,true,false,false],[false,false,false,false,false,false,true,true,false,false],[false,false,false,false,false,false,false,true,false,false],[false,false,false,false,false,false,false,false,true,false],[false,false,false,false,false,false,false,false,false,true]]},"result":{"score":3,"optimal_count":"56","alignments":[{"aligned_a":"GCAAAAAAAATC","aligned_b":"GC---AAAAATC","cigar":"2=3D7=","path":[[0,0],[1,1],[2,2],[3,2],[4,2],[5,2],[6,3],[7,4],[8,5],[9,6],[10,7],[11,8],[12,9]]},{"aligned_a":"GCAAAAAAAATC","aligned_b":"GC--A-AAAATC","cigar":"2=2D1=1D6=","path":[[0,0],[1,1],[2,2],[3,2],[4,2],[5,3],[6,3],[7,4],[8,5],[9,6],[10,7],[11,8],[12,9]]},{"aligned_a":"GCAAAAAAAATC","aligned_b":"GC-A--AAAATC","cigar":"2=1D1=2D6=","path":[[0,0],[1,1],[2,2],[3,2],[4,3],[5,3],[6,3],[7,4],[8,5],[9,6],[10,7],[11,8],[12,9]]},{"aligned_a":"GCAAAAAAAATC","aligned_b":"GCA---AAAATC","cigar":"3=3D6=","path":[[0,0],[1,1],[2,2],[3,3],[4,3],[5,3],[6,3],[7,4],[8,5],[9,6],[10,7],[11,8],[12,9]]},{"aligned_a":"GCAAAAAAAATC","aligned_b":"GC--AA-AAATC","cigar":"2=2D2=1D5=","path":[[0,0],[1,1],[2,2],[3,2],[4,2],[5,3],[6,4],[7,4],[8,5],[9,6],[10,7],[11,8],[12,9]]},{"aligned_a":"GCAAAAAAAATC","aligned_b":"GC-A-A-AAATC","cigar":"2=1D1=1D1=1D5=","path":[[0,0],[1,1],[2,2],[3,2],[4,3],[5,3],[6,4],[7,4],[8,5],[9,6],[10,7],[11,8],[12,9]]},{"aligned_a":"GCAAAAAAAATC","aligned_b":"GCA--A-AAATC","cigar":"3=2D1=1D5=","path":[[0,0],[1,1],[2,2],[3,3],[4,3],[5,3],[6,4],[7,4],[8,5],[9,6],[10,7],[11,8],[12,9]]},{"aligned_a":"GCAAAAAAAATC","aligned_b":"GC-AA--AAATC","cigar":"2=1D2=2D5=","path":[[0,0],[1,1],[2,2],[3,2],[4,3],[5,4],[6,4],[7,4],[8,5],[9,6],[10,7],[11,8],[12,9]]},{"aligned_a":"GCAAAAAAAATC","aligned_b":"GCA-A--AAATC","cigar":"3=1D1=2D5=","path":[[0,0],[1,1],[2,2],[3,3],[4,3],[5,4],[6,4],[7,4],[8,5],[9,6],[10,7],[11,8],[12,9]]},{"aligned_a":"GCAAAAAAAATC","aligned_b":"GCAA---AAATC","cigar":"4=3D5=","path":[[0,0],[1,1],[2,2],[3,3],[4,4],[5,4],[6,4],[7,4],[8,5],[9,6],[10,7],[11,8],[12,9]]},{"aligned_a":"GCAAAAAAAATC","aligned_b":"GC--AAA-AATC","cigar":"2=2D3=1D4=","path":[[0,0],[1,1],[2,2],[3,2],[4,2],[5,3],[6,4],[7,5],[8,5],[9,6],[10,7],[11,8],[12,9]]},{"aligned_a":"GCAAAAAAAATC","aligned_b":"GC-A-AA-AATC","cigar":"2=1D1=1D2=1D4=","path":[[0,0],[1,1],[2,2],[3,2],[4,3],[5,3],[6,4],[7,5],[8,5],[9,6],[10,7],[11,8],[12,9]]},{"aligned_a":"GCAAAAAAAATC","aligned_b":"GCA--AA-AATC","cigar":"3=2D2=1D4=","path":[[0,0],[1,1],[2,2],[3,3],[4,3],[5,3],[6,4],[7,5],[8,5],[9,6],[10,7],[11,8],[12,9]]},{"aligned_a":"GCAAAAAAAATC","aligned_b":"GC-AA-A-AATC","cigar":"2=1D2=1D1=1D4=","path":[[0,0],[1,1],[2,2],[3,2],[4,3],[5,4],[6,4],[7,5],[8,5],[9,6],[10,7],[11,8],[12,9]]},{"aligned_a":"GCAAAAAAAATC","aligned_b":"GCA-A-A-AATC","cigar":"3=1D1=1D1=1D4=","path":[[0,0],[1,1],[2,2],[3,3],[4,3],[5,4],[6,4],[7,5],[8,5],[9,6],[10,7],[11,8],[12,9]]},{"aligned_a":"GCAAAAAAAATC","aligned_b":"GCAA--A-AATC","cigar":"4=2D1=1D4=","path":[[0,0],[1,1],[2,2],[3,3],[4,4],[5,4],[6,4],[7,5],[8,5],[9,6],[10,7],[11,8],[12,9]]}],"alignments_truncated":true},"layers":[{"name":"M","scores":[[0,null,null,null,null,null,null,null,null,null],[null,1,-3,-5,-7,-9,-11,-13,-15,-17],[null,-3,2,-2,-4,-6,-8,-10,-12,-12],[null,-5,-2,3,1,-1,-3,-5,-9,-11],[null,-7,-4,1,4,2,0,-2,-6,-8],[null,-9,-6,-1,2,5,3,1,-3,-5],[null,-11,-8,-3,0,3,6,4,0,-2],[null,-13,-10,-5,-2,1,4,7,3,1],[null,-15,-12,-7,-4,-1,2,5,6,4],[null,-17,-14,-9,-6,-3,0,3,4,5],[null,-19,-16,-11,-8,-5,-2,1,2,3],[null,-21,-18,-15,-12,-9,-6,-3,2,1],[null,-23,-18,-17,-14,-11,-8,-5,-2,3]],"predecessors":[[0,0,0,0,0,0,0,0,0,0],[0,1,4,4,4,4,4,4,4,4],[0,2,1,4,4,4,4,4,4,4],[0,2,2,1,4,4,4,4,4,4],[0,2,2,2,1,5,5,5,5,4],[0,2,2,2,3,1,5,5,5,4],[0,2,2,2,3,3,1,5,5,4],[0,2,2,2,3,3,3,1,5,4],[0,2,2,2,3,3,3,3,1,4],[0,2,2,2,3,3,3,3,3,1],[0,2,2,2,3,3,3,3,3,3],[0,2,2,2,3,3,3,3,3,3],[0,2,2,2,2,2,2,2,2,1]]},{"name":"X","scores":[[null,null,null,null,null,null,null,null,null,null],[-2,-4,-6,-8,-10,-12,-14,-16,-18,-20],[-4,-1,-3,-5,-7,-9,-11,-13,-15,-17],[-6,-3,0,-2,-4,-6,-8,-10,-12,-14],[-8,-5,-2,1,-1,-3,-5,-7,-9,-11],[-10,-7,-4,-1,2,0,-2,-4,-6,-8],[-12,-9,-6,-3,0,3,1,-1,-3,-5],[-14,-11,-8,-5,-2,1,4,2,0,-2],[-16,-13,-10,-7,-4,-1,2,5,3,1],[-18,-15,-12,-9,-6,-3,0,3,4,2],[-20,-17,-14,-11,-8,-5,-2,1,2,3],[-22,-19,-16,-13,-10,-7,-4,-1,0,1],[-24,-21,-18,-15,-12,-9,-6,-3,0,-1]],"predecessors":[[0,0,0,0,0,0,0,0,0,0],[1,4,4,4,4,4,4,4,4,4],[2,1,4,4,4,4,4,4,4,4],[2,2,1,4,4,4,4,4,4,5],[2,2,2,1,5,5,5,5,4,4],[2,2,2,3,1,5,5,5,4,4],[2,2,2,3,3,1,5,5,4,4],[2,2,2,3,3,3,1,5,4,4],[2,2,2,3,3,3,3,1,4,4],[2,2,2,3,3,3,3,3,1,5],[2,2,2,3,3,3,3,3,3,1],[2,2,2,3,3,3,3,3,3,3],[2,2,2,2,2,2,2,2,1,3]]},{"name":"Y","scores":[[null,-2,-4,-6,-8,-10,-12,-14,-16,-18],[null,-4,-1,-3,-5,-7,-9,-11,-13,-15],[null,-6,-3,0,-2,-4,-6,-8,-10,-12],[null,-8,-5,-2,1,-1,-3,-5,-7,-9],[null,-10,-7,-4,-1,2,0,-2,-4,-6],[null,-12,-9,-6,-3,0,3,1,-1,-3],[null,-14,-11,-8,-5,-2,1,4,2,0],[null,-16,-13,-10,-7,-4,-1,2,5,3],[null,-18,-15,-12,-9,-6,-3,0,3,4],[null,-20,-17,-14,-11,-8,-5,-2,1,2],[null,-22,-19,-16,-13,-10,-7,-4,-1,0],[null,-24,-21,-18,-15,-12,-9,-6,-3,0],[null,-26,-23,-20,-17,-14,-11,-8,-5,-2]],"predecessors":[[0,1,4,4,4,4,4,4,4,4],[0,2,1,4,4,4,4,4,4,4],[0,2,2,1,4,4,4,4,4,4],[0,2,2,2,1,5,5,5,5,4],[0,2,2,2,3,1,5,5,5,4],[0,2,2,2,3,3,1,5,5,4],[0,2,2,2,3,3,3,1,5,4],[0,2,2,2,3,3,3,3,1,4],[0,2,2,2,3,3,3,3,3,1],[0,2,2,2,3,3,3,3,3,3],[0,2,2,2,3,3,3,3,3,3],[0,2,2,2,2,2,2,2,2,1],[0,2,2,3,2,2,2,2,2,2]]}]}
